{
  "units": {
    "battlesector_logo": {
      "url": "https://pub-8aef1ac0e5c34cf4b4ece60640fe773c.r2.dev/units/battlesector_logo.png",
      "r2_key": "units/battlesector_logo.png",
      "source": "sharedassets0.assets"
    },
    "Knob": {
      "url": "https://pub-8aef1ac0e5c34cf4b4ece60640fe773c.r2.dev/units/Knob.png",
      "r2_key": "units/Knob.png",
      "source": "sharedassets1.assets"
    },
    "GladiatorLancerIcon": {
      "url": "https://pub-8aef1ac0e5c34cf4b4ece60640fe773c.r2.dev/units/GladiatorLancerIcon.png",
      "r2_key": "units/GladiatorLancerIcon.png",
      "source": "sharedassets1.assets"
    },
    "armypointcap_icon_gold": {
      "url": "https://pub-8aef1ac0e5c34cf4b4ece60640fe773c.r2.dev/units/armypointcap_icon_gold.png",
      "r2_key": "units/armypointcap_icon_gold.png",
      "source": "sharedassets1.assets"
    },
    "SaveIcon_default": {
      "url": "https://pub-8aef1ac0e5c34cf4b4ece60640fe773c.r2.dev/units/SaveIcon_default.png",
      "r2_key": "units/SaveIcon_default.png",
      "source": "sharedassets1.assets"
    },
    "TournamentSmallIcon2": {
      "url": "https://pub-8aef1ac0e5c34cf4b4ece60640fe773c.r2.dev/units/TournamentSmallIcon2.png",
      "r2_key": "units/TournamentSmallIcon2.png",
      "source": "sharedassets1.assets"
    },
    "UnitIcon Selection Edge_highlight_ModelViewer": {
      "url": "https://pub-8aef1ac0e5c34cf4b4ece60640fe773c.r2.dev/units/UnitIcon Selection Edge_highlight_ModelViewer.png",
      "r2_key": "units/UnitIcon Selection Edge_highlight_ModelViewer.png",
      "source": "sharedassets1.assets"
    },
    "cover_icons": {
      "url": "https://pub-8aef1ac0e5c34cf4b4ece60640fe773c.r2.dev/units/cover_icons.png",
      "r2_key": "units/cover_icons.png",
      "source": "sharedassets1.assets"
    },
    "SaveIcon_hover": {
      "url": "https://pub-8aef1ac0e5c34cf4b4ece60640fe773c.r2.dev/units/SaveIcon_hover.png",
      "r2_key": "units/SaveIcon_hover.png",
      "source": "sharedassets1.assets"
    },
    "ErrorIcon": {
      "url": "https://pub-8aef1ac0e5c34cf4b4ece60640fe773c.r2.dev/units/ErrorIcon.png",
      "r2_key": "units/ErrorIcon.png",
      "source": "sharedassets1.assets"
    },
    "icon_FailedImage": {
      "url": "https://pub-8aef1ac0e5c34cf4b4ece60640fe773c.r2.dev/units/icon_FailedImage.png",
      "r2_key": "units/icon_FailedImage.png",
      "source": "sharedassets1.assets"
    },
    "RedThirstIcon": {
      "url": "https://pub-8aef1ac0e5c34cf4b4ece60640fe773c.r2.dev/units/RedThirstIcon.png",
      "r2_key": "units/RedThirstIcon.png",
      "source": "sharedassets1.assets"
    },
    "SaveIcon_pressed": {
      "url": "https://pub-8aef1ac0e5c34cf4b4ece60640fe773c.r2.dev/units/SaveIcon_pressed.png",
      "r2_key": "units/SaveIcon_pressed.png",
      "source": "sharedassets1.assets"
    },
    "ArmyPopInceaseIcon": {
      "url": "https://pub-8aef1ac0e5c34cf4b4ece60640fe773c.r2.dev/units/ArmyPopInceaseIcon.png",
      "r2_key": "units/ArmyPopInceaseIcon.png",
      "source": "sharedassets1.assets"
    },
    "modio-icon-color": {
      "url": "https://pub-8aef1ac0e5c34cf4b4ece60640fe773c.r2.dev/units/modio-icon-color.png",
      "r2_key": "units/modio-icon-color.png",
      "source": "sharedassets1.assets"
    },
    "AssualtMarineIcon-small": {
      "url": "https://pub-8aef1ac0e5c34cf4b4ece60640fe773c.r2.dev/units/AssualtMarineIcon-small.png",
      "r2_key": "units/AssualtMarineIcon-small.png",
      "source": "sharedassets1.assets"
    },
    "UnitIcon_MidGradient_modelVeiwer": {
      "url": "https://pub-8aef1ac0e5c34cf4b4ece60640fe773c.r2.dev/units/UnitIcon_MidGradient_modelVeiwer.png",
      "r2_key": "units/UnitIcon_MidGradient_modelVeiwer.png",
      "source": "sharedassets1.assets"
    },
    "UI_WPN_BLA_BPL_Icon": {
      "url": "https://pub-8aef1ac0e5c34cf4b4ece60640fe773c.r2.dev/units/UI_WPN_BLA_BPL_Icon.png",
      "r2_key": "units/UI_WPN_BLA_BPL_Icon.png",
      "source": "sharedassets1.assets"
    },
    "UnitIcon_UnitMask_modelVeiwer": {
      "url": "https://pub-8aef1ac0e5c34cf4b4ece60640fe773c.r2.dev/units/UnitIcon_UnitMask_modelVeiwer.png",
      "r2_key": "units/UnitIcon_UnitMask_modelVeiwer.png",
      "source": "sharedassets1.assets"
    },
    "ArmyManagementIcon": {
      "url": "https://pub-8aef1ac0e5c34cf4b4ece60640fe773c.r2.dev/units/ArmyManagementIcon.png",
      "r2_key": "units/ArmyManagementIcon.png",
      "source": "sharedassets1.assets"
    },
    "FolderIcon": {
      "url": "https://pub-8aef1ac0e5c34cf4b4ece60640fe773c.r2.dev/units/FolderIcon.png",
      "r2_key": "units/FolderIcon.png",
      "source": "sharedassets1.assets"
    },
    "GoUpFolderIcon": {
      "url": "https://pub-8aef1ac0e5c34cf4b4ece60640fe773c.r2.dev/units/GoUpFolderIcon.png",
      "r2_key": "units/GoUpFolderIcon.png",
      "source": "sharedassets1.assets"
    },
    "action Point slot icon": {
      "url": "https://pub-8aef1ac0e5c34cf4b4ece60640fe773c.r2.dev/units/action Point slot icon.png",
      "r2_key": "units/action Point slot icon.png",
      "source": "sharedassets1.assets"
    },
    "3CCUI_traystatusICON-LOCKED": {
      "url": "https://pub-8aef1ac0e5c34cf4b4ece60640fe773c.r2.dev/units/3CCUI_traystatusICON-LOCKED.png",
      "r2_key": "units/3CCUI_traystatusICON-LOCKED.png",
      "source": "sharedassets1.assets"
    },
    "LibrarianDreadnoughtIcon-small": {
      "url": "https://pub-8aef1ac0e5c34cf4b4ece60640fe773c.r2.dev/units/LibrarianDreadnoughtIcon-small.png",
      "r2_key": "units/LibrarianDreadnoughtIcon-small.png",
      "source": "sharedassets1.assets"
    },
    "DeathFromAboveIcon": {
      "url": "https://pub-8aef1ac0e5c34cf4b4ece60640fe773c.r2.dev/units/DeathFromAboveIcon.png",
      "r2_key": "units/DeathFromAboveIcon.png",
      "source": "sharedassets1.assets"
    },
    "TournamentSmallIcon3": {
      "url": "https://pub-8aef1ac0e5c34cf4b4ece60640fe773c.r2.dev/units/TournamentSmallIcon3.png",
      "r2_key": "units/TournamentSmallIcon3.png",
      "source": "sharedassets1.assets"
    },
    "UnitIconBG_modelVeiwer": {
      "url": "https://pub-8aef1ac0e5c34cf4b4ece60640fe773c.r2.dev/units/UnitIconBG_modelVeiwer.png",
      "r2_key": "units/UnitIconBG_modelVeiwer.png",
      "source": "sharedassets1.assets"
    },
    "AssualtMarineIcon": {
      "url": "https://pub-8aef1ac0e5c34cf4b4ece60640fe773c.r2.dev/units/AssualtMarineIcon.png",
      "r2_key": "units/AssualtMarineIcon.png",
      "source": "sharedassets1.assets"
    },
    "InteractIcon": {
      "url": "https://pub-8aef1ac0e5c34cf4b4ece60640fe773c.r2.dev/units/InteractIcon.png",
      "r2_key": "units/InteractIcon.png",
      "source": "sharedassets1.assets"
    },
    "TournamentSmallIcon1": {
      "url": "https://pub-8aef1ac0e5c34cf4b4ece60640fe773c.r2.dev/units/TournamentSmallIcon1.png",
      "r2_key": "units/TournamentSmallIcon1.png",
      "source": "sharedassets1.assets"
    },
    "reqCooldownIcon": {
      "url": "https://pub-8aef1ac0e5c34cf4b4ece60640fe773c.r2.dev/units/reqCooldownIcon.png",
      "r2_key": "units/reqCooldownIcon.png",
      "source": "sharedassets1.assets"
    },
    "check_thin_icon": {
      "url": "https://pub-8aef1ac0e5c34cf4b4ece60640fe773c.r2.dev/units/check_thin_icon.png",
      "r2_key": "units/check_thin_icon.png",
      "source": "sharedassets1.assets"
    },
    "ActionPointSml_icon": {
      "url": "https://pub-8aef1ac0e5c34cf4b4ece60640fe773c.r2.dev/units/ActionPointSml_icon.png",
      "r2_key": "units/ActionPointSml_icon.png",
      "source": "sharedassets1.assets"
    },
    "clipboard_icon": {
      "url": "https://pub-8aef1ac0e5c34cf4b4ece60640fe773c.r2.dev/units/clipboard_icon.png",
      "r2_key": "units/clipboard_icon.png",
      "source": "sharedassets1.assets"
    },
    "X_icon": {
      "url": "https://pub-8aef1ac0e5c34cf4b4ece60640fe773c.r2.dev/units/X_icon.png",
      "r2_key": "units/X_icon.png",
      "source": "sharedassets1.assets"
    },
    "icon_search": {
      "url": "https://pub-8aef1ac0e5c34cf4b4ece60640fe773c.r2.dev/units/icon_search.png",
      "r2_key": "units/icon_search.png",
      "source": "sharedassets1.assets"
    },
    "error_icon": {
      "url": "https://pub-8aef1ac0e5c34cf4b4ece60640fe773c.r2.dev/units/error_icon.png",
      "r2_key": "units/error_icon.png",
      "source": "sharedassets1.assets"
    },
    "icon_mail": {
      "url": "https://pub-8aef1ac0e5c34cf4b4ece60640fe773c.r2.dev/units/icon_mail.png",
      "r2_key": "units/icon_mail.png",
      "source": "sharedassets1.assets"
    },
    "icon_user_logged-out": {
      "url": "https://pub-8aef1ac0e5c34cf4b4ece60640fe773c.r2.dev/units/icon_user_logged-out.png",
      "r2_key": "units/icon_user_logged-out.png",
      "source": "sharedassets1.assets"
    },
    "icon_mobile_24x24": {
      "url": "https://pub-8aef1ac0e5c34cf4b4ece60640fe773c.r2.dev/units/icon_mobile_24x24.png",
      "r2_key": "units/icon_mobile_24x24.png",
      "source": "sharedassets1.assets"
    },
    "BaalforaWaterTank-Single-Metal_D": {
      "url": "https://pub-8aef1ac0e5c34cf4b4ece60640fe773c.r2.dev/units/BaalforaWaterTank-Single-Metal_D.png",
      "r2_key": "units/BaalforaWaterTank-Single-Metal_D.png",
      "source": "sharedassets10.assets"
    },
    "Prop_BaalforaWaterTank-Triple_N": {
      "url": "https://pub-8aef1ac0e5c34cf4b4ece60640fe773c.r2.dev/units/Prop_BaalforaWaterTank-Triple_N.png",
      "r2_key": "units/Prop_BaalforaWaterTank-Triple_N.png",
      "source": "sharedassets10.assets"
    },
    "BaalforaWaterTank-Single-Metal_N": {
      "url": "https://pub-8aef1ac0e5c34cf4b4ece60640fe773c.r2.dev/units/BaalforaWaterTank-Single-Metal_N.png",
      "r2_key": "units/BaalforaWaterTank-Single-Metal_N.png",
      "source": "sharedassets10.assets"
    },
    "Prop_BaalforaWaterTank-Triple_D": {
      "url": "https://pub-8aef1ac0e5c34cf4b4ece60640fe773c.r2.dev/units/Prop_BaalforaWaterTank-Triple_D.png",
      "r2_key": "units/Prop_BaalforaWaterTank-Triple_D.png",
      "source": "sharedassets10.assets"
    },